{
  "template_info": {
    "name": "citizen_participation",
    "version": "1.0.0",
    "description": "Comprehensive template for citizen participation and democratic processes matching Agora default configuration",
    "author": "Agora Team",
    "use_case": "citizen_participation",
    "available_languages": [
      "en",
      "fr",
      "de",
      "gsw"
    ]
  },
  "inquiry_families": [
    {
      "family_type": "deliberative",
      "label": {
        "en": "Deliberative",
        "fr": "Délibératif",
        "de": "Beratend",
        "gsw": "Berotend"
      },
      "description": {
        "en": "Citizen-driven deliberative processes including proposals, petitions, initiatives, debates, and deliberations",
        "fr": "Processus délibératifs citoyens incluant propositions, pétitions, initiatives, débats et délibérations",
        "de": "Bürgergetriebene Beratungsprozesse einschließlich Vorschläge, Petitionen, Initiativen, Debatten und Beratungen",
        "gsw": "Bürger-tribeeni Berotigsprozäss inkl. Vorschläg, Petitione, Initiative, Debatte und Berotige"
      },
      "icon": "AccountGroup",
      "sort_order": 1
    },
    {
      "family_type": "legislative",
      "label": {
        "en": "Legislative",
        "fr": "Législatif",
        "de": "Legislative",
        "gsw": "Gsetzgebend"
      },
      "description": {
        "en": "Legislative processes including law proposals, amendments, constitutional workshops, and policy consultations",
        "fr": "Processus législatifs incluant propositions de loi, amendements, ateliers constitutionnels et consultations politiques",
        "de": "Gesetzgebungsverfahren einschließlich Gesetzesvorschläge, Änderungsanträge, Verfassungsworkshops und Politikberatungen",
        "gsw": "Gsetzgeberisch Verfahre inkl. Gsetzesvorschläg, Änderigsdräg, Verfassigs-Workshops und Politik-Berotige"
      },
      "icon": "Gavel",
      "sort_order": 2
    },
    {
      "family_type": "administrative",
      "label": {
        "en": "Administrative",
        "fr": "Administratif",
        "de": "Verwaltung",
        "gsw": "Verwautig"
      },
      "description": {
        "en": "Administrative requests and grievances addressed to public institutions",
        "fr": "Demandes administratives et réclamations adressées aux institutions publiques",
        "de": "Verwaltungsanfragen und Beschwerden an öffentliche Institutionen",
        "gsw": "Verwautigsaafrage und Beschweärde a öffentlichi Institutione"
      },
      "icon": "OfficeBuilding",
      "sort_order": 3
    },
    {
      "family_type": "service",
      "label": {
        "en": "Service",
        "fr": "Service",
        "de": "Dienst",
        "gsw": "Dienscht"
      },
      "description": {
        "en": "Social and citizen service requests including housing, childcare, scholarships, and social support",
        "fr": "Demandes de services sociaux et citoyens incluant logement, garde d'enfants, bourses et aide sociale",
        "de": "Sozial- und Bürgerdienstanfragen einschließlich Wohnraum, Kinderbetreuung, Stipendien und Sozialhilfe",
        "gsw": "Sozial- und Bürger-Dienschtaafrage inkl. Wohnruum, Chinderbetreuig, Stipendie und Sozialhilf"
      },
      "icon": "Offer",
      "sort_order": 4
    },
    {
      "family_type": "collective",
      "label": {
        "en": "Collective",
        "fr": "Collectif",
        "de": "Kollektiv",
        "gsw": "Kollektiv"
      },
      "description": {
        "en": "Collective processes including assemblies, consultations, polls, and grouped deliberations",
        "fr": "Processus collectifs incluant assemblées, consultations, sondages et délibérations groupées",
        "de": "Kollektive Prozesse einschließlich Versammlungen, Konsultationen, Umfragen und gruppierte Beratungen",
        "gsw": "Kollektivi Prozäss inkl. Versammlige, Konsultatione, Umfrage und gruppierti Berotige"
      },
      "icon": "AccountMultiple",
      "sort_order": 5
    },
    {
      "family_type": "social",
      "label": {
        "en": "Social",
        "fr": "Social",
        "de": "Sozial",
        "gsw": "Sozial"
      },
      "description": {
        "en": "Social assistance requests from citizens for daily life support",
        "fr": "Demandes d'aide sociale des citoyens pour le soutien quotidien",
        "de": "Sozialhilfeanfragen von Bürgern zur Unterstützung im Alltag",
        "gsw": "Sozialhilf-Aafrage vo Bürger zur Understützig im Alltag"
      },
      "icon": "Heart",
      "sort_order": 6
    },
    {
      "family_type": "official_citizen_participation",
      "label": {
        "en": "Official",
        "fr": "Officiel",
        "de": "Offiziell",
        "gsw": "Offiziell"
      },
      "description": {
        "en": "Official responses and contributions from government entities, experts, and commissions",
        "fr": "Réponses et contributions officielles d'entités gouvernementales, d'experts et de commissions",
        "de": "Offizielle Antworten und Beiträge von Regierungsstellen, Experten und Kommissionen",
        "gsw": "Offizelli Antworte und Biiträg vo Regierigsstelle, Experte und Kommissione"
      },
      "icon": "Seal",
      "sort_order": 7
    }
  ],
  "inquiry_types": [
    {
      "inquiry_type": "proposal",
      "family": "deliberative",
      "icon": "LightbulbOn",
      "label": {
        "en": "Proposal",
        "fr": "Proposition",
        "de": "Vorschlag",
        "gsw": "Vorschlag"
      },
      "description": {
        "en": "Citizen proposal for community or organizational improvement with support collection",
        "fr": "Proposition citoyenne pour l'amélioration communautaire ou organisationnelle avec collecte de soutien",
        "de": "Bürgervorschlag zur Verbesserung der Gemeinschaft oder Organisation mit Unterstützungssammlung",
        "gsw": "Bürger-Vorschlag zur Verbesserig vo de Gmeinschaft oder Organisation mit Understützig-Sammlig"
      },
      "is_root": true,
      "fields": [
        {"key": "quorum", "label": "Quorum", "type": "integer", "required": false, "default": null, "rules": []},
        {"key": "parent_law_id", "label": "Parent Law", "type": "integer", "required": false, "default": null, "rules": []},
        {"key": "topic", "label": "Topic", "type": "string", "required": true, "default": null, "rules": []},
        {"key": "form_schema", "label": "Form Schema", "type": "json", "required": false, "default": null, "rules": []},
        {"key": "type_of_vote", "label": "Type of Vote", "type": "enum", "required": false, "default": "simple", "allowed_values": ["simple", "majority_judgement_beneficial", "majority_judgement_number"], "rules": []},
        {"key": "support_start", "label": "Supporting Start", "type": "datetime", "required": false, "default": null, "rules": []},
        {"key": "support_end", "label": "Supporting End", "type": "datetime", "required": false, "default": null, "rules": []},
        {"key": "auto_reminder", "label": "Auto Reminder", "type": "boolean", "required": true, "default": true, "rules": []},
        {"key": "layout_zone", "label": "Position display into the layout", "type": "enum", "required": false, "default": "footer", "allowed_values": ["sidebar", "main", "footer", "header"], "rules": []},
        {"key": "render_mode", "label": "Render mode of inquiries", "type": "enum", "required": false, "default": "rich_html", "allowed_values": ["cards", "list", "full", "summary", "rich_html"], "rules": []},
        {"key": "open_mode", "label": "Open Mode", "type": "enum", "required": false, "default": "page", "allowed_values": ["page", "modal", "popup"], "rules": []},
        {"key": "allow_anonymous", "label": "Allow Anonymous Feedback", "type": "boolean", "required": false, "default": false, "rules": []}
      ],
      "allowed_response": [
        "objection",
        "suggestion",
        "official_citizen_participation"
      ],
      "allowed_transformation": [
        "law_proposal"
      ]
    },
    {
      "inquiry_type": "petition",
      "family": "deliberative",
      "icon": "ClipboardText",
      "label": {
        "en": "Petition",
        "fr": "Pétition",
        "de": "Petition",
        "gsw": "Petition"
      },
      "description": {
        "en": "Formal petition requiring citizen signatures for a specific cause or request",
        "fr": "Pétition formelle nécessitant des signatures citoyennes pour une cause ou demande spécifique",
        "de": "Formale Petition, die Bürgersignaturen für ein bestimmtes Anliegen oder eine Anfrage erfordert",
        "gsw": "Formelli Petition wo Bürger-Unterschrifte brucht für es bestimmts Aalige oder Aafrag"
      },
      "is_root": true,
      "fields": [
        {"key": "topic", "label": "Topic", "type": "string", "required": true, "default": null, "rules": []},
        {"key": "form_schema", "label": "Form Schema", "type": "json", "required": false, "default": null, "rules": []},
        {"key": "type_of_vote", "label": "Type of Vote", "type": "enum", "required": false, "default": "simple", "allowed_values": ["simple", "majority_judgement_beneficial", "majority_judgement_number"], "rules": []},
        {"key": "support_start", "label": "Supporting Start", "type": "datetime", "required": false, "default": null, "rules": []},
        {"key": "support_end", "label": "Supporting End", "type": "datetime", "required": false, "default": null, "rules": []},
        {"key": "auto_reminder", "label": "Auto Reminder", "type": "boolean", "required": true, "default": true, "rules": []},
        {"key": "layout_zone", "label": "Position display into the layout", "type": "enum", "required": false, "default": "footer", "allowed_values": ["sidebar", "main", "footer", "header"], "rules": []},
        {"key": "render_mode", "label": "Render mode of inquiries", "type": "enum", "required": false, "default": "rich_html", "allowed_values": ["cards", "list", "full", "summary", "rich_html"], "rules": []},